fusion_id	bp1_gene_symbol	bp2_gene_symbol	fusion_type	reading_frame	disease_genes	disease_gene_count	bp1_seqname	bp1_pos	bp2_seqname	bp2_pos	is_canonical	in_frame	hotspot_tissue_count	hotspot_tissues
FGFR1::RALYL_i_i_30EFE4	FGFR1	RALYL	Canonical	Out-of-frame	None	0					TRUE	FALSE	56	Adipose_Subcutaneous; Adipose_Visceral_Omentum; Artery_Aorta; Artery_Coronary; Artery_Tibial; Bladder; Brain_Cerebellum; Brain_Spinal_cord_cervical_c-1; Breast_Mammary_Tissue; Cells_Cultured_fibroblasts; Cells_EBV-transformed_lymphocytes; Cervix_Ectocervix; Cervix_Endocervix; Colon_Sigmoid; Colon_Transverse; Colon_Transverse_Mixed_Cell; Colon_Transverse_Mucosa; Colon_Transverse_Muscularis; Esophagus_Gastroesophageal_Junction; Esophagus_Mucosa; Esophagus_Muscularis; Fallopian_Tube; Heart_Atrial_Appendage; Heart_Left_Ventricle; Kidney_Cortex; Kidney_Medulla; Liver; Liver_Hepatocyte; Liver_Mixed_Cell; Liver_Portal_Tract; Lung; Minor_Salivary_Gland; Muscle_Skeletal; Nerve_Tibial; Ovary; Pancreas; Pancreas_Acini; Pancreas_Islets; Pancreas_Mixed_Cell; Pituitary; Prostate; Skin_Not_Sun_Exposed_Suprapubic; Skin_Sun_Exposed_Lower_leg; Small_Intestine_Terminal_Ileum; Small_Intestine_Terminal_Ileum_Lymphoid_Aggregate; Small_Intestine_Terminal_Ileum_Mixed_Cell; Spleen; Stomach; Stomach_Mixed_Cell; Stomach_Mucosa; Stomach_Muscularis; Testis; Thyroid; Uterus; Vagina; Whole_Blood
RALYL::FGFR1_i_i_30EFE4	RALYL	FGFR1	Canonical	In-frame	None	0					TRUE	TRUE	1	Brain_Frontal_Cortex_BA9
ENSG00000255201::RALYL_i_i_30EFE4	ENSG00000255201	RALYL	Non-canonical	Unknown	None	0					FALSE	NA	49	Adipose_Subcutaneous; Adipose_Visceral_Omentum; Artery_Aorta; Artery_Coronary; Artery_Tibial; Bladder; Breast_Mammary_Tissue; Cells_Cultured_fibroblasts; Cells_EBV-transformed_lymphocytes; Cervix_Ectocervix; Cervix_Endocervix; Colon_Sigmoid; Colon_Transverse; Colon_Transverse_Mixed_Cell; Colon_Transverse_Mucosa; Colon_Transverse_Muscularis; Esophagus_Gastroesophageal_Junction; Esophagus_Mucosa; Esophagus_Muscularis; Fallopian_Tube; Heart_Atrial_Appendage; Heart_Left_Ventricle; Liver; Liver_Hepatocyte; Liver_Mixed_Cell; Lung; Minor_Salivary_Gland; Muscle_Skeletal; Nerve_Tibial; Ovary; Pancreas; Pancreas_Acini; Pancreas_Mixed_Cell; Pituitary; Prostate; Skin_Not_Sun_Exposed_Suprapubic; Skin_Sun_Exposed_Lower_leg; Small_Intestine_Terminal_Ileum; Small_Intestine_Terminal_Ileum_Lymphoid_Aggregate; Small_Intestine_Terminal_Ileum_Mixed_Cell; Stomach; Stomach_Mixed_Cell; Stomach_Mucosa; Stomach_Muscularis; Testis; Thyroid; Uterus; Vagina; Whole_Blood
RALYL::ENSG00000255201_i_i_30EFE4	RALYL	ENSG00000255201	Non-canonical	Unknown	None	0					FALSE	NA	13	Adrenal_Gland; Brain_Amygdala; Brain_Anterior_cingulate_cortex_BA24; Brain_Caudate_basal_ganglia; Brain_Cerebellar_Hemisphere; Brain_Cortex; Brain_Frontal_Cortex_BA9; Brain_Hippocampus; Brain_Hypothalamus; Brain_Nucleus_accumbens_basal_ganglia; Brain_Putamen_basal_ganglia; Brain_Spinal_cord_cervical_c-1; Brain_Substantia_nigra
CLMN::_i_0_40D498	CLMN	NA	Non-canonical	Unknown	None	0					FALSE	NA	0	None
SCN2A::SCN1A_i_e_4984E3	SCN2A	SCN1A	Non-canonical	Unknown	None	0					FALSE	NA	24	Adipose_Visceral_Omentum; Adrenal_Gland; Artery_Aorta; Artery_Coronary; Brain_Anterior_cingulate_cortex_BA24; Brain_Cerebellar_Hemisphere; Brain_Cerebellum; Brain_Nucleus_accumbens_basal_ganglia; Breast_Mammary_Tissue; Cervix_Ectocervix; Cervix_Endocervix; Colon_Sigmoid; Kidney_Cortex; Kidney_Medulla; Nerve_Tibial; Ovary; Pancreas_Islets; Pituitary; Small_Intestine_Terminal_Ileum_Lymphoid_Aggregate; Stomach; Stomach_Mixed_Cell; Stomach_Mucosa; Uterus; Vagina
SCN2A::SCN1A-AS1_i_i_4984E3	SCN2A	SCN1A-AS1	Canonical	Unknown	None	0					TRUE	NA	35	Adipose_Visceral_Omentum; Adrenal_Gland; Artery_Aorta; Artery_Coronary; Brain_Amygdala; Brain_Anterior_cingulate_cortex_BA24; Brain_Caudate_basal_ganglia; Brain_Cerebellar_Hemisphere; Brain_Cerebellum; Brain_Cortex; Brain_Frontal_Cortex_BA9; Brain_Hippocampus; Brain_Hypothalamus; Brain_Nucleus_accumbens_basal_ganglia; Brain_Putamen_basal_ganglia; Brain_Spinal_cord_cervical_c-1; Brain_Substantia_nigra; Breast_Mammary_Tissue; Cervix_Ectocervix; Cervix_Endocervix; Colon_Sigmoid; Colon_Transverse_Muscularis; Fallopian_Tube; Kidney_Cortex; Kidney_Medulla; Nerve_Tibial; Ovary; Pancreas_Islets; Pituitary; Small_Intestine_Terminal_Ileum_Lymphoid_Aggregate; Stomach; Stomach_Mixed_Cell; Stomach_Mucosa; Uterus; Vagina
PHF6::HPRT1_i_i_912279	PHF6	HPRT1	Canonical	In-frame	None	0					TRUE	TRUE	0	None
